[
	{
		"id": "wikipedia-metro",
		"title": "Wikipedia - Metro de Santiago",
		"url": "https://es.wikipedia.org/wiki/Metro_de_Santiago",
		"consultedAt": "2024-12"
	},
	{
		"id": "metro-oficial",
		"title": "Metro de Santiago - Sitio oficial corporativo",
		"url": "https://www.metro.cl/corporativo/historia",
		"consultedAt": "2024-12"
	},
	{
		"id": "plataforma-urbana",
		"title": "Plataforma Urbana - Metro cumple 40 años",
		"url": "https://www.plataformaurbana.cl/archive/2015/09/15/metro-de-santiago-uno-de-los-primeros-sistemas-de-metro-de-sudamerica-hoy-cumple-40-anos/",
		"consultedAt": "2024-12"
	},
	{
		"id": "memoria-chilena",
		"title": "Memoria Chilena - Biblioteca Nacional de Chile",
		"url": "https://www.memoriachilena.gob.cl/602/w3-article-97809.html",
		"consultedAt": "2024-12"
	},
	{
		"id": "metro-50",
		"title": "Metro de Santiago - Especial 50 años",
		"url": "https://www.metro.cl/especial50/",
		"consultedAt": "2024-12"
	},
	{
		"id": "lub-upc",
		"title": "Laboratori d'Urbanisme de Barcelona - UPC",
		"url": "https://lub.upc.edu/en/2012/03/06/las-estaciones-que-fundaron-el-metro-en-santiago-de-chile/",
		"consultedAt": "2024-12"
	},
	{
		"id": "wikipedia-ns74",
		"title": "Wikipedia - NS-74 (trenes originales)",
		"url": "https://es.wikipedia.org/wiki/NS-74",
		"consultedAt": "2024-12"
	},
	{
		"id": "wikipedia-historia",
		"title": "Historia del Metro de Santiago - Wikipedia",
		"url": "https://es.wikipedia.org/wiki/Historia_del_Metro_de_Santiago",
		"consultedAt": "2024-12"
	},
	{
		"id": "wikipedia-l1",
		"title": "Wikipedia - Línea 1 del Metro de Santiago",
		"url": "https://es.wikipedia.org/wiki/L%C3%ADnea_1_del_Metro_de_Santiago",
		"consultedAt": "2024-12"
	},
	{
		"id": "wikipedia-l2",
		"title": "Wikipedia - Línea 2 del Metro de Santiago",
		"url": "https://es.wikipedia.org/wiki/L%C3%ADnea_2_del_Metro_de_Santiago",
		"consultedAt": "2024-12"
	},
	{
		"id": "wikipedia-l3",
		"title": "Wikipedia - Línea 3 del Metro de Santiago",
		"url": "https://es.wikipedia.org/wiki/L%C3%ADnea_3_del_Metro_de_Santiago",
		"consultedAt": "2024-12"
	},
	{
		"id": "wikipedia-l4",
		"title": "Wikipedia - Línea 4 del Metro de Santiago",
		"url": "https://es.wikipedia.org/wiki/L%C3%ADnea_4_del_Metro_de_Santiago",
		"consultedAt": "2024-12"
	},
	{
		"id": "wikipedia-l5",
		"title": "Wikipedia - Línea 5 del Metro de Santiago",
		"url": "https://es.wikipedia.org/wiki/L%C3%ADnea_5_del_Metro_de_Santiago",
		"consultedAt": "2024-12"
	},
	{
		"id": "wikipedia-l6",
		"title": "Wikipedia - Línea 6 del Metro de Santiago",
		"url": "https://es.wikipedia.org/wiki/L%C3%ADnea_6_del_Metro_de_Santiago",
		"consultedAt": "2024-12"
	},
	{
		"id": "somos-tour",
		"title": "Somos Tour - Arte en el Metro",
		"url": "https://somostour.cl/ver-arte-el-metro/",
		"consultedAt": "2024-12"
	},
	{
		"id": "lonely-planet",
		"title": "Lonely Planet & BBC - Estaciones más bellas del mundo",
		"url": "",
		"consultedAt": "2024-12"
	},
	{
		"id": "wikipedia-pajaritos",
		"title": "Wikipedia - Pajaritos (estación)",
		"url": "https://es.wikipedia.org/wiki/Pajaritos_(estaci%C3%B3n)",
		"consultedAt": "2024-12"
	},
	{
		"id": "wikipedia-santa-lucia",
		"title": "Wikipedia - Santa Lucía (estación)",
		"url": "https://es.wikipedia.org/wiki/Santa_Luc%C3%ADa_(estaci%C3%B3n)",
		"consultedAt": "2024-12"
	},
	{
		"id": "metro-baquedano",
		"title": "Metro de Santiago - Estación Baquedano",
		"url": "https://www.metro.cl/porstgo/BA",
		"consultedAt": "2024-12"
	},
	{
		"id": "wikipedia-pedro-valdivia",
		"title": "Wikipedia - Pedro de Valdivia (estación)",
		"url": "https://es.wikipedia.org/wiki/Pedro_de_Valdivia_(estaci%C3%B3n)",
		"consultedAt": "2024-12"
	},
	{
		"id": "fandom-los-leones",
		"title": "Wiki Metro de Santiago (Fandom) - Los Leones",
		"url": "https://metrodesantiago.fandom.com/es/wiki/Los_Leones",
		"consultedAt": "2024-12"
	},
	{
		"id": "wikipedia-vespucio-norte",
		"title": "Wikipedia - Vespucio Norte (estación)",
		"url": "https://es.wikipedia.org/wiki/Vespucio_Norte_(estaci%C3%B3n)",
		"consultedAt": "2024-12"
	},
	{
		"id": "fandom-zapadores",
		"title": "Wiki Metro de Santiago (Fandom) - Zapadores",
		"url": "https://metrodesantiago.fandom.com/es/wiki/Zapadores",
		"consultedAt": "2024-12"
	},
	{
		"id": "fandom-einstein",
		"title": "Wiki Metro de Santiago (Fandom) - Einstein",
		"url": "https://metrodesantiago.fandom.com/es/wiki/Einstein",
		"consultedAt": "2024-12"
	},
	{
		"id": "wikipedia-cementerios",
		"title": "Wikipedia - Cementerios (estación)",
		"url": "https://es.wikipedia.org/wiki/Cementerios_(estaci%C3%B3n)",
		"consultedAt": "2024-12"
	},
	{
		"id": "wikipedia-cerro-blanco",
		"title": "Wikipedia - Cerro Blanco (estación)",
		"url": "https://es.wikipedia.org/wiki/Cerro_Blanco_(estaci%C3%B3n)",
		"consultedAt": "2024-12"
	},
	{
		"id": "wikipedia-patronato",
		"title": "Wikipedia - Patronato (estación)",
		"url": "https://es.wikipedia.org/wiki/Patronato_(estaci%C3%B3n)",
		"consultedAt": "2024-12"
	},
	{
		"id": "lugares-que-ver",
		"title": "Lugares que Ver - Puente Cal y Canto",
		"url": "https://lugaresquever.com/wiki/puente-cal-y-canto",
		"consultedAt": "2024-12"
	},
	{
		"id": "cmn-cal-y-canto",
		"title": "Consejo de Monumentos Nacionales - Puente Cal y Canto",
		"url": "https://www.monumentos.gob.cl/monumentos/monumentos-historicos/todos-los-restos-del-puente-de-cal-y-canto-de-santiago",
		"consultedAt": "2024-12"
	},
	{
		"id": "itchile-toesca",
		"title": "itChile - Estaciones Toesca y Rondizzoni",
		"url": "https://chile.italiani.it/las-estaciones-toesca-y-rondizzoni-del-metro-de-santiago/",
		"consultedAt": "2024-12"
	},
	{
		"id": "fandom-parque-ohiggins",
		"title": "Wiki Metro de Santiago (Fandom) - Parque O'Higgins",
		"url": "https://metrodesantiago.fandom.com/es/wiki/Parque_O'Higgins",
		"consultedAt": "2024-12"
	},
	{
		"id": "fandom-franklin",
		"title": "Wiki Metro de Santiago (Fandom) - Franklin",
		"url": "https://metrodesantiago.fandom.com/es/wiki/Franklin",
		"consultedAt": "2024-12"
	},
	{
		"id": "wikipedia-el-llano",
		"title": "Wikipedia - El Llano (estación)",
		"url": "https://es.wikipedia.org/wiki/El_Llano_(estaci%C3%B3n)",
		"consultedAt": "2024-12"
	},
	{
		"id": "fandom-san-miguel",
		"title": "Wiki Metro de Santiago (Fandom) - San Miguel",
		"url": "https://metrodesantiago.fandom.com/es/wiki/San_Miguel",
		"consultedAt": "2024-12"
	},
	{
		"id": "wikipedia-lo-ovalle",
		"title": "Wikipedia - Lo Ovalle (estación)",
		"url": "https://es.wikipedia.org/wiki/Lo_Ovalle_(estaci%C3%B3n)",
		"consultedAt": "2024-12"
	},
	{
		"id": "la-tercera-nombres",
		"title": "La Tercera - ¿Cómo se eligen los nombres de las estaciones?",
		"url": "https://www.latercera.com/nacional/noticia/sabes-se-eligen-los-nombres-las-estaciones-metro/441710/",
		"consultedAt": "2024-12"
	},
	{
		"id": "wikipedia-eyzaguirre",
		"title": "Wikipedia - Monseñor Eyzaguirre (estación)",
		"url": "https://es.wikipedia.org/wiki/Monse%C3%B1or_Eyzaguirre_(estaci%C3%B3n)",
		"consultedAt": "2024-12"
	},
	{
		"id": "msgg-l3",
		"title": "Ministerio Secretaría General de Gobierno - Inauguración L3",
		"url": "https://msgg.gob.cl/wp/2019/01/22/llego-el-dia-linea-3-de-metro-inicia-su-recorrido-con-pasajeros-uniendo-seis-comunas-de-la-region-metropolitana/",
		"consultedAt": "2024-12"
	},
	{
		"id": "la-tercera-himmel",
		"title": "La Tercera - Peter Himmel, arquitecto del Metro",
		"url": "https://www.latercera.com/la-tercera-domingo/noticia/peter-himmel-arquitecto-del-metro-de-santiago-es-ilogico-destruir-lo-poco-que-tenemos/",
		"consultedAt": "2024-12"
	},
	{
		"id": "la-cuarta-fantasmas",
		"title": "La Cuarta - Estaciones fantasmas del Metro",
		"url": "https://www.lacuarta.com/cronica/noticia/estaciones-fantasmas--del-pategoma-penan-a-vecinos/116909/",
		"consultedAt": "2024-12"
	},
	{
		"id": "la-tercera-libertad",
		"title": "La Tercera - Vecinos piden habilitar estación Libertad",
		"url": "https://www.latercera.com/noticia/vecinos-del-barrio-yungay-piden-hailitar-estacion-libertad-de-linea-5-del-metro/",
		"consultedAt": "2024-12"
	},
	{
		"id": "wikipedia-material-rodante",
		"title": "Wikipedia - Material rodante del Metro de Santiago",
		"url": "https://es.wikipedia.org/wiki/Anexo:Material_rodante_del_Metro_de_Santiago",
		"consultedAt": "2024-12"
	},
	{
		"id": "wikipedia-l7",
		"title": "Wikipedia - Línea 7 del Metro de Santiago",
		"url": "https://es.wikipedia.org/wiki/L%C3%ADnea_7_del_Metro_de_Santiago",
		"consultedAt": "2024-12"
	},
	{
		"id": "gob-l8",
		"title": "Gob.cl - Nueva Línea 8 de Metro",
		"url": "https://www.gob.cl/noticias/conozca-cual-sera-el-trayecto-de-la-nueva-linea-8-de-metro/",
		"consultedAt": "2024-12"
	},
	{
		"id": "gob-l9",
		"title": "Gob.cl - Línea 9 de Metro",
		"url": "https://www.gob.cl/noticias/presidente-anuncia-tramos-y-estaciones-de-nueva-linea-9-de-metro/",
		"consultedAt": "2024-12"
	},
	{
		"id": "fundacion-futuro",
		"title": "Guía Metodológica - Fundación Futuro",
		"url": "http://www.fundacionfuturo.cl/wp-content/uploads/2019/07/ciudadenmetro.pdf",
		"consultedAt": "2024-12"
	},
	{
		"id": "metroarte-org",
		"title": "MetroArte - Obras del programa",
		"url": "http://www.arauco.org/gmv/proyectos/chilehoy/MetroArte/MetroArte.html",
		"consultedAt": "2024-12"
	},
	{
		"id": "memoria-2024",
		"title": "Memoria Integrada 2024 - Metro de Santiago",
		"url": "https://www.metro.cl/gobierno-corporativo/memoria",
		"consultedAt": "2024-12"
	},
	{
		"id": "emol-l7-2025",
		"title": "Emol - Línea 7 llega al 30% de avance (junio 2025)",
		"url": "https://www.emol.com/noticias/Nacional/2025/06/30/1170813/linea-7-metro-santiago-avances.html",
		"consultedAt": "2025-12"
	},
	{
		"id": "alstom-l7-tren",
		"title": "Alstom - Producción primer tren Línea 7 (julio 2025)",
		"url": "https://www.alstom.com/press-releases-news/2025/7/alstom-completes-production-first-train-carbody-shell-santiago-metro-line-7",
		"consultedAt": "2025-12"
	},
	{
		"id": "metro-l7-oficial",